{
  "name": "Harbourlight Health claims platform: test-generation golden set",
  "version": "1.0",
  "change_history": [
    {
      "version": "1.0",
      "date": "2026-10-22",
      "change": "Frozen for the Day 4 benchmark after review. Wording only, meaning unchanged: S04-I06 grammar, S10-I04 apostrophe, S08-I04 duplicated phrase. Any later change needs a new version and a rerun."
    },
    {
      "version": "0.4-draft",
      "date": "2026-10-22",
      "change": "Extensive updates based on feedback. Further negative tests added to ensure each user story covers each test technique at least once, typos, apply changes around test ideas for correctness"
    },
    {
      "version": "0.3-draft",
      "date": "2026-10-22",
      "change": "Roger's expected ideas added (67). Mechanical fixes by Claude: S03 and S10 duplicate idea IDs renumbered, S09-I04 AC4 -> AC1, routing spelling auto_approved -> auto_approve, S06-I06 category typo, S02-I04 typo. S04 resolved question restored from v0.2. Schema: optional boundary_exempt_reason added and set for S01, S07, S10."
    },
    {
      "version": "0.2-draft",
      "date": "2026-10-21",
      "change": "S04: day-0 convention confirmed against claim_triage.csv (HLH-021/022); open question moved to resolved_questions. Schema: optional resolved_questions field added."
    },
    {
      "version": "0.1-draft",
      "date": "2026-10-21",
      "change": "First draft: 10 stories with acceptance criteria. expected_ideas left empty for Roger to write."
    }
  ],
  "test_basis": [
    "datasets/plan_rules.md (sections 4 to 8)",
    "datasets/policy_docs/01-10_*.md (Day 3 member documents)"
  ],
  "notes": [
    "Fictional insurer, synthetic data only. All amounts in EUR.",
    "The generator receives title, user story and acceptance_criteria only. It does not see plan_rules.md, basis_refs, open_questions or expected_ideas.",
    "Values needed for boundary cases are written into the acceptance criteria for that reason.",
    "Routing and reason codes use the names from plan_rules.md sections 2 and 7.",
    "expected_ideas are the oracle and are shown to the judge only (recall check).",
    "Positive: the AC’s rule applies as stated, including decline outcomes.",
    "Negative: missing, invalid or misleading input, or a case where the rule must not fire.",
    "Boundary: either side of a numeric limit, a date or the edge of a definition, one side per idea.",
    "Classify by the input: if it is missing, invalid or misleading, the idea is negative. An exemption stated in an AC is positive."
  ],
  "stories": [
    {
      "story_id": "S01",
      "title": "Submit a claim with an itemised receipt",
      "as_a": "member",
      "i_want": "to attach an itemised receipt when I submit a claim in the member portal",
      "so_that": "my claim can be assessed and paid",
      "acceptance_criteria": [
        {"ac_id": "AC1", "text": "A member can submit a claim through the member portal with an itemised receipt attached."},
        {"ac_id": "AC2", "text": "An itemised receipt shows the treatment, the treatment date and the amount. A document missing any of these is not an itemised receipt."},
        {"ac_id": "AC3", "text": "A payment card slip or a bank statement is not an itemised receipt. A claim supported only by one of these is treated as having no receipt."},
        {"ac_id": "AC4", "text": "A claim with no itemised receipt is never recommended for automatic approval. It is routed to manual_review with reason code MISSING_RECEIPT."}
      ],
      "basis_refs": [
        "plan_rules.md 5 (Receipt)",
        "plan_rules.md 6 step 3.1",
        "plan_rules.md 8",
        "06_how_to_claim.md",
        "10_contact_and_privacy.md"
      ],
      "open_questions": [
        "AC3 second sentence is derived: 06_how_to_claim.md says a card slip or bank statement is not an itemised receipt, but not explicitly that the claim is then treated as having none.",
        "The assumption is that identity checks are out of scope. When creating the ideas one negative check would be to ensure that a non-member cannot claim. For purposes of this exercise this scenario is not being considered.",
        "Processing of duplicate receipts is out of scope. There was an initial test idea added where the claim may contain duplicate receipts if attached incorrectly. This was removed to not complicate the set-up."
      ],
      "expected_ideas": [
        {"idea_id": "S01-I01", "ac_ids": ["AC1", "AC2"], "technique": "positive", "idea": "A valid member submits a claim through the portal with itemised receipt. All details are correct and therefore claim is routed but reason code is not MISSING_RECEIPT."},
        {"idea_id": "S01-I02", "ac_ids": ["AC2"], "technique": "negative", "idea": "The receipt is attached to the claim but missing amount information and therefore routing should be manual_review with MISSING_RECEIPT."},
        {"idea_id": "S01-I03", "ac_ids": ["AC2"], "technique": "negative", "idea": "The receipt is attached to the claim but missing treatment date information and therefore routing should be manual_review with MISSING_RECEIPT."},        
        {"idea_id": "S01-I04", "ac_ids": ["AC3"], "technique": "negative", "idea": "The member submits a bank statement instead of a receipt. The claim will be routed to manual_review and MISSING_RECEIPT."},
        {"idea_id": "S01-I05", "ac_ids": ["AC3"], "technique": "negative", "idea": "The member submits a card slip instead of a receipt. The claim will be routed to manual_review and MISSING_RECEIPT."},
        {"idea_id": "S01-I06", "ac_ids": ["AC4"], "technique": "negative", "idea": "There is no itemised receipt with the claim. In this scenario routing will be manual_review and MISSING_RECEIPT"}
      ],
      "boundary_exempt_reason": "ACs define which documents count as an itemised receipt; there is no numeric limit or date."
    },
    {
      "story_id": "S02",
      "title": "Check pre-authorisation for hospital treatment",
      "as_a": "claims assessor",
      "i_want": "day case and inpatient claims checked for a pre-authorisation number",
      "so_that": "hospital treatment that was not approved in advance is never paid automatically",
      "acceptance_criteria": [
        {"ac_id": "AC1", "text": "A day case procedure is hospital treatment without an overnight stay. An inpatient stay is one or more nights in hospital. Both need a pre-authorisation number."},
        {"ac_id": "AC2", "text": "A day case or inpatient claim with a blank pre-authorisation number is routed to manual_review with reason code MISSING_PREAUTH."},
        {"ac_id": "AC3", "text": "Every inpatient claim that has a pre-authorisation number is routed to manual_review with reason code INPATIENT_REVIEW."},
        {"ac_id": "AC4", "text": "GP visits, consultant visits, physiotherapy and prescriptions do not need a pre-authorisation number."}
      ],
      "basis_refs": [
        "plan_rules.md 4",
        "plan_rules.md 6 steps 3.3 and 3.4",
        "05_pre_authorisation.md"
      ],
      "open_questions": [
        "The set up assumes that any pre-authorisation number provided is in a valid format."
      ],
      "expected_ideas": [
        {"idea_id": "S02-I01", "ac_ids": ["AC1"], "technique": "positive", "idea": "A day case procedure with a pre-authorisation number contained and within limits will not be routed with MISSING_PREAUTH."},
        {"idea_id": "S02-I02", "ac_ids": ["AC2"], "technique": "negative", "idea": "A day case procedure claim with a missing pre-authorisation will be routed to manual_review with reason code MISSING_PREAUTH."},
        {"idea_id": "S02-I03", "ac_ids": ["AC2"], "technique": "negative", "idea": "An inpatient stay claim with a missing pre-authorisation number will be routed to manual_review with reason code MISSING_PREAUTH and not INPATIENT_REVIEW."},
        {"idea_id": "S02-I04", "ac_ids": ["AC3"], "technique": "positive", "idea": "An inpatient stay claim with a pre-authorisation number will be routed to manual_review with reason code INPATIENT_REVIEW."},
        {"idea_id": "S02-I05", "ac_ids": ["AC4"], "technique": "positive", "idea": "On submission, claims that are GP visits can have blank pre-authorisation numbers and reason code will not be MISSING_PREAUTH"},
        {"idea_id": "S02-I06", "ac_ids": ["AC4"], "technique": "positive", "idea": "On submission, claims that are consultant visits can have blank pre-authorisation numbers and reason code will not be MISSING_PREAUTH"},
        {"idea_id": "S02-I07", "ac_ids": ["AC1"], "technique": "boundary", "idea": "A hospital treatment claim with an overnight stay including a pre-authorisation number is routed as manual_review with reason code INPATIENT_REVIEW and not flagged as a day case."},
        {"idea_id": "S02-I08", "ac_ids": ["AC1"], "technique": "boundary", "idea": "A hospital treatment claim with no overnight stay including a pre-authorisation number should not be routed as INPATIENT_REVIEW."}
      ]
    },
    {
      "story_id": "S03",
      "title": "Track annual limits per policy year",
      "as_a": "claims assessor",
      "i_want": "the number of paid visits or items in each category counted per policy year",
      "so_that": "claims beyond the annual limit are recommended for decline",
      "acceptance_criteria": [
        {"ac_id": "AC1", "text": "The first policy year starts on the date cover began; each later policy year starts on the anniversary of that date. Each runs for 12 months."},
        {"ac_id": "AC2", "text": "Annual limits: GP visit 8 visits, consultant visit 4 visits, physiotherapy 10 sessions, prescription 12 items, day case procedure 2 procedures. Inpatient stays have no fixed annual count; they are assessed individually."},